URL,StructuredResponse
https://en.wikipedia.org/wiki/Canoo,"

Canoo is an American automotive company based in Torrance, California, that develops and manufactures electric vehicles.[2][3] Canoo's research & development team is based in Michigan, in the Detroit region (Auburn Hills, Livonia), and production operations are in Justin, Texas. The company also plans to produce commercial electric vehicles such as vans for fleet, vehicle rental and ride sharing services.[4]

Canoo was founded in 2017 under the name Evelozcity by Stefan Krause and Ulrich Kranz. Krause worked for Deutsche Bank as its chief financial officer while Kranz worked for BMW as a senior executive. Both men met at rival EV company Faraday Future before leaving together to form their own company in 2017, due to disagreement with Faraday Future's leadership. Krause took on the role of chief executive officer at Evelozcity, and Kranz became chief technology officer.[5] The company received its primary funding from Chinese investor Li ""David"" Pak-Tam/Botan and German entrepreneur David Stern.[6][7]

In April 2018, Evelozcity Canoo hired Karl-Thomas Neumann, the former head of Opel as a senior executive.[8] In March 2019 Evelozcity was renamed Canoo.[9] In July 2019, Neumann left Canoo, but he remained an investor in the company.[10]



In September 2019, the company presented its first vehicle prototype, the electric van Canoo, which was later renamed to the Canoo Lifestyle Vehicle.[11]

In February 2020, Hyundai Motor Group, the parent company of Hyundai Motors and Kia Motors, announced that the company would partner with Canoo on the joint development of a new electric vehicle platform. The platform would be used for compact vehicles and for fleet vehicles such as shuttles. The deal is part of Hyundai's Strategy 2025 program which will see Hyundai investing US$87 billion for five years starting in 2020.[12][13][14]

In July 2020, co-founder Stefan Krause left the company. He had previously taken an extended leave of absence in August 2019 for family reasons. Co-founder Ulrich Kranz assumed the role of permanent CEO upon Krause's departure.[15][16]

In July 2020, Canoo featured on the TV program Jay Leno's Garage.[17]

In September 2020, Canoo announced a merger with the special-purpose acquisition company Hennessy Capital Acquisition Corp. IV., intending to list Canoo on the NASDAQ valued at $2.4 billion.[18] The expectation was to raise $300 million to help finance the production of the Canoo minivan, planned for launch in 2022.[19][20] On December 22, 2020, Canoo completed its merger with Hennessy Capital Acquisition Corp IV.[21]

A few days before its stock exchange debut, the company announced its MPDV (Multi-Purpose Delivery Vehicle) product line. The entry level van was expected to sell for $33,000 on arrival in limited quantities in 2022, ramping up to volume production in 2023.[22]

In mid-January 2021, The Verge reported that in the first half of 2020 Canoo had been in talks with Apple for a potential role in its secretive Titan car project.[23][24]

In May 2022, it was reported that Canoo was struggling to find funding, the company saying that it had only enough funding to operate for one more quarter.[25] It was also revealed around the same time that Canoo was suing investor Pak Tim Li, claiming they were selling shares improperly.[26]

In December 2022, the company sued several former executives of stealing Canoo's trade secrets and poaching talent for their new business,[27][28] competing EV startup Harbinger Motors.[29]



On March 11, 2021, Canoo announced the Canoo Pickup Truck, an electric pickup set to release in 2023.[30][31] Canoo announced plans to offer both single-motor and dual-motor all-wheel drive options for their pickup truck, with the latter being capable of producing 600 hp (450 kW) and 550 foot-pounds (750 J) of torque.[30] The company said that the truck would have over 200 miles (320 km) of range and a 1,800 lb (820 kg) payload capacity.[30] After the announcement, shares of the company rose by 14%.[31]

It was announced in March 2021 that Canoo had terminated its partnership with Hyundai Motor Group due to a change in corporate strategy. The company also announced that it would shift away from vehicle subscriptions to selling commercial vehicles.[32]

On April 22, 2021, the company announced that co-founder and CEO Ulrich Kranz was stepping down and would be replaced by chairman Tony Aquila as CEO.[33] Also in April 2021, the U.S. Securities and Exchange Commission launched an investigation into Canoo after its merger with Hennessy Capital Acquisition Corp. IV due to a string of executive departures, sudden changes to its business model, and class-action lawsuits brought by shareholders.[34]

On June 17, 2021, the company announced they would build a new factory in Pryor, Oklahoma (just outside Tulsa) to manufacture all of their future vehicles.[35][36] The plant will be used to build ""pod-shaped vans it calls 'lifestyle vehicles' beginning in 2023.""[36] The same day, Dutch media reported that the Dutch company VDL Nedcar would start producing Canoo Minivans for the European market.[37] Later in the year, Canoo and VDL ended the manufacturing agreement.[38]

On November 15, 2021, the company announced it would move its headquarters to Bentonville, Arkansas and establish a manufacturing plant there.[39] As of December 2022[update] the company still lists Torrance, California as its headquarters.[1][40]

In January 2022, Canoo entered into a 10-year US$17.7 million lease for a building in Bentonville, Arkansas for an ""advanced industrialization facility"" to be used for low-volume manufacturing.[41] In August 2022, Canoo disclosed they had contracted with a third party for their initial vehicle production.

Following receipt of orders in October 2022, Canoo announced plans for construction of a vehicle battery production facility at the MidAmerica Industrial Park (MAIP) in Pryor, Oklahoma.[42] This was in addition to its earlier announcement of plans for a vehicle production plant at MAIP capable of producing 300,000 vehicles per year.[43] In late November 2022, Canoo announced an agreement to purchase of an existing 630,000 square foot plant in Oklahoma City to start vehicle production by 2023, prior to completion of its micro megafactory in Pryor.[44]  In April 2023, the company announced that battery production would proceed at Pryor to fulfill a United States Department of Defense contract; and, while vehicle manufacturing was to start in Oklahoma City before the end of 2023, long range plans still included vehicle assembly at Pryor because the OKC facility would not meet full production needs.[45] The Oklahoma City plant transaction was completed on April 7, 2023; the plant was formerly owned and operated by Terex.[46]

On April 13, 2022, NASA selected Canoo to supply crew transportation vehicles for its Artemis program, with a total contract value of $147,855.[47][48]

In July 2022, Walmart entered into a definitive agreement to purchase 4,500 all-electric Lifestyle Delivery Vehicles (LDV) from Canoo, with an option to buy up to 10,000 in the future.[49] Under the terms, Walmart can terminate the agreement for convenience upon 30 days notice.[50]

Canoo announced two major orders in mid-October 2022. Zeeba, a relatively unknown fleet leasing operation, also based in Greater Los Angeles, ordered a combination of 5,450 LDVs and Lifestyle Vehicles (LV), with a binding commitment of 3,000 by 2024.[51][52][53] Some days later, Canoo announced its biggest sale to date, an order from Kingbee, a Utah-based work-ready van fleet rental company. In addition to the binding order of 9,300 LDVs, Kingbee has the option to double the order.[54][55] Kingbee outfits its vans for fleet customers in construction trades (electrical, plumbing, energy), delivery, and mobile health.[56]

In January 2024, Canoo announced the Postal Service (USPS) order for six right-hand-drive LDV vans.[57][58][59]
"
https://fortune.com/2022/08/29/canoo-ev-startup-scored-deal-worlds-largest-retailer/,"Good morning,
The push for the use of electric vehicles in the U.S. is ramping up. Especially in California as the state just put a ban on gas-burning cars by 2035. Tony Aquila, the CEO of Canoo, a public EV company, is certain he can compete with brands like Tesla. But there’s one hurdle—Canoo hasn’t yet generated any revenue. 
Walmart signed an agreement with Canoo in July to purchase 4,500 all-electric delivery vehicles, beginning with the Lifestyle Delivery Vehicle, with the option to purchase up to 10,000 units. But the company is “hanging on by a thread,” writes my colleague Jessica Mathews.
“Inside the chaos at Canoo, the zero-revenue, cash-burning EV company that just inked a major deal with Walmart,” is Mathews’ new report that gives the scoop on the inner workings of the Bentonville, Arkansas-based startup.
Canoo said in its Q2 2022 earnings report the company has “over $1 billion” in its sales pipeline. But it reported a net loss of $164.4 million, up from $112.6 million in Q2 of last year. 
On the Aug. 8 earnings call, Ramesh Murthy, interim CFO and chief accounting officer, talked about the “road to profitability.” Murthy said: “It’s becoming more clear to everyone that our philosophy on cash and access to capital is in line with what a technology-driven company would do. We are milestone and event focused on how we access capital on our road to profitability. By focusing on milestones and key events, we can drive sustainable value to the company and all our stakeholders.”
Mathews interviewed Aquila in June and rode in one of Canoo’s futuristic electric campervans. 
“Canoo’s vehicles were still going through test programs and not yet on the market,” she writes. “Production wouldn’t begin until at least the end of 2022, and the company hadn’t started construction on its own manufacturing facilities. (The van we were sitting in was a prototype.)”
She continues, “Canoo had just recently signed an agreement with hedge fund Yorkville Advisors to sell up to $250 million worth of its shares at a discount to their already depressed market price. The Securities and Exchange Commission was investigating the company over its 2020 SPAC merger, and the company was tied up in three legal spats, including two class action lawsuits from retail investors in its shares. Indeed, right there in an SEC filing from March 31, Canoo itself had said it might not make it another year.” 
“And yet, Aquila—the tattooed, 57-year-old private-equity executive who had begun taking control of the company in 2020—looked me right in the eye when I asked about whether Canoo had the funding it needed for the next year. ‘I am a just-in-time capital guy,’ he assured me.” Mathews also discovered that Walmart’s purchase of yet-to-be-produced EVs is not the first financial boost that Aquila has received from the Walmart family in his career.  
Automakers are now required to steadily increase their sales of zero-emission cars in California, the nation’s largest auto market. And because 17 other states typically follow California’s auto-emissions standards, last week’s vote by the California Air Resources Board could reach far beyond the state, requiring the auto industry to speed up its switch to electric cars, Fortune reported. 
As the electric vehicle market continues to evolve, “Canoo is hardly the only EV startup to take investors and employees on a wild ride over the past couple of years,” Mathews writes. “Concern over climate change has lured an unprecedented amount of investor capital into the space, but the logistical challenges of launching an automaker from scratch haven’t gotten any less daunting.”
But, “Crack open the hood even an inch, however, and it’s clear that, even with the Walmart deal, Canoo is floundering to an extreme degree,” Mathews writes. (You can read the complete article here.) 
See you tomorrow. 
Sheryl Estradasheryl.estrada@fortune.com
Deloitte’s Q3 CFO Signals survey released today found that, overall, nearly half (46%) of CFOs expect the North American economy to be in recession by the new year. But it also varies by industry. For example, 67% of CFOs in the energy/resources industry expect a recession in North America by 2023, compared to 52% of CFOs in manufacturing, 50% in technology, 48% in financial services, and 25% in health care. CFOs are pursuing recession-proofing measures such as reducing operating expenses, controlling headcount, and reprioritizing capital expenditure. However, CFOs’ concerns over inflation vastly outweighed recession concerns. CFOs have lower expectations for year-over-year revenue growth— 6.2% this quarter, down from 7.8% in Q2 2022. Meanwhile, earnings growth expectations are at 6.4%, a decline from 8.4% in the prior quarter. The findings of Deloitte's quarterly CFO survey are based on a survey of 112 CFOs (74% from public companies and 26% from privately held firms). Respondents are from the U.S., Canada, and Mexico, and the vast majority are from companies with more than $1 billion in annual revenue.

""Gen X is cutting back on everything because of inflation—except retirement savings,"" a Fortune report by Alicia Adamczyk, is an analysis of State Street Global Advisors’s recent Inflation Impact Survey. As Gen X gets closer to retirement, they’re “significantly” more concerned about rising prices than millennials or Baby Boomers. 
Dave McKinstray was named CFO at North America Cereal Co., the upcoming spinoff of Kellogg Company (NYSE: K). As announced in June 2022, Kellogg Company plans to separate three of its businesses—Global Snacking Co., North America Cereal Co., and Plant Co. McKinstray held several CFO roles throughout his nearly 15 years at Kellogg, such as CFO of the U.S. Snacks business and as CFO of U.S. Retail Sales before moving into his current role as VP of integrated business planning. His roles before Kellogg included positions in commodity risk management and trading.
Christoph Pachler was named CFO at FaZe Holdings Inc. (Nasdaq: FAZE) a lifestyle and media platform focused on gaming and youth culture, effective on or before October 3. Pachler has more than 25 years of financial management experience. Pachler joins FaZe Clan from Critical Content, an independent television studio in Los Angeles, where he served as managing director and CFO. Before Critical Content, Pachler was the EVP and CFO for Playboy Enterprises, a media and brand licensing company. Pachler previously spent 13 years in various expanding roles at Sony Pictures Entertainment, where he was lastly the CFO and SVP for strategy and operations in Sony's international TV business.
""Inflation numbers can miss the mark on properly reflecting a country’s economic mood because these figures offer an incomplete picture of a country’s economic health. Consumer sentiment, on the other hand, reflects our attitudes about the current state of the economy and expectations about its trajectory. And by all accounts, consumer sentiment is at record lows–and its decline has been more protracted than during past dips.""
—Christos A. Makridis, a professor, entrepreneur, and adviser who serves as an adjunct fellow at the Manhattan Institute, explained in a Fortune opinion piece that research shows consumer sentiment matters more than inflation and unemployment numbers. 
This is the web version of CFO Daily, a newsletter on the trends and individuals shaping corporate finance. Sign up to get it delivered free to your inbox.
© 2023 Fortune Media IP Limited. All Rights Reserved. Use of this site constitutes acceptance of our Terms of Use and Privacy Policy | CA Notice at Collection and Privacy Notice | Do Not Sell/Share My Personal Information | Ad Choices 
FORTUNE is a trademark of Fortune Media IP Limited, registered in the U.S. and other countries. FORTUNE may receive compensation for some links to products and services on this website. Offers may be subject to change without notice.
S&P Index data is the property of Chicago Mercantile Exchange Inc. and its licensors. All rights reserved. Terms & Conditions. Powered and implemented by Interactive Data Managed Solutions."
https://www.industryweek.com/leadership/companies-executives/article/21263239/canoo-sticks-to-2023-production-target,"Electric carmaker Canoo will shift from  R&D to focus more on manufacturing in 2023, hoping to further slash operating expenses following a 45% reduction last year, CEO Tony Aquila said. Executives  expect operating expenses to be between $55 and  $70 million and capital expenditures between $30 and $45 million, both reductions  from 2022 goals.
“Migrating from an R&D design and premarket delivery to  a manufacturing and market launch organization hitting these milestones will  better help us manage the current market turbulence,” he said. 
Ramping up production in 2023 means hitting a 20,000-unit run  rate at its Oklahoma City factory, a number executives have held firm on since  Q3. Canoo currently has a $2.8 billion order book, including 4,500 vans to be  used as Walmart delivery vehicles. 
Aquila’s  affirmation of Canoo’s production target stands in contrast with Arrival,  another EV commercial vehicle startup, which had to dial  back its ambitions over the past year (On a related note, General Motors Corp.'s  BrightDrop division will this year deliver the first 200 of 4,000 electric vans  to Ryder System Inc.). But Canoo still has work to do: When asked about the current  level of preparedness, Aquila said they were in the “65%-ish range of items on  the ground, probably at north of 85% with what's inbound,” although they’d  found a workflow that supported their confidence in achieving it.
Canoo announced its Q4 results on  March 30, which showed it failed to generate any revenue in the quarter and  experienced a comprehensive loss of $82 million, compared to $138.1 million in  Q4 2021, and $487.7 million for the year, compared to $346.8 million last year.  The company posted a going concern at the end of Q1, as it lost $125 million in  the period and had less than that in cash left. Q4 also saw Canoo settle the  SEC investigation into whether former senior executives had misled investors,  and the company will pay a $1.5 million fine as result. 
Despite the lows of the year,  executives remained optimistic about the big picture. They delivered Canoo’s first  light tactical vehicle (LTV) to the U.S. Army and entered a partnership with a  Saudi Arabian distribution company. With the investigation wrapped up, Aquila said Canoo can now apply for government programs such as the “Department of Energy loan program and  things of that nature.” 
After  reporting earnings, Canoo stock (Ticker: GOEV) fell from trading at $0.62 per  share to $0.60 the following day, although it ended up rising to $0.69 that  same day. Over the past six months, they have continued a general downward  trend, currently trading 66% lower than the Oct. 2022 high. "
https://investors.canoo.com/news-presentations/press-releases/detail/75/canoo-increases-production-guidance-and-targets-for-us,"JUSTIN, Texas, Dec. 15, 2021 /PRNewswire/ -- Canoo Inc. (Nasdaq: GOEV) today announced it will accelerate and now shift production of its breakthrough electric vehicles from Europe to the United States. The Company will begin manufacturing at its advanced industrialization facility planned for Northwest Arkansas and remains on target to bring online its Mega Micro factory in Pryor, Oklahoma in late 2023. 





""Canoo is now in a position to issue guidance at a time when many others in the industry are reducing targets and projections. The Company has now refined its manufacturing strategy and assembled a team to execute the production roadmap for 2022 – 2025"" said Tony Aquila, Investor, Chairman & CEO at Canoo Inc.
""In addition, we will be 100% built in the heartland of America, and we have proudly achieved another major milestone of having sourced 96% percent of our parts from U.S. and Allied Nations.""
The Company ceased contract manufacturing discussions with VDL Nedcar with the completion of our manufacturing strategy which accelerates our ability to access our incentives from Oklahoma and Arkansas. The outcome of this will be:
""The initiatives announced today are another step in executing our strategy of reducing risk and increasing certainty. We look forward to additional announcements."" said Tony Aquila, Investor, Chairman and CEO.
About Canoo
Canoo's mission is to bring EVs to Everyone. The company has developed breakthrough electric vehicles that are reinventing the automotive landscape with bold innovations in design, pioneering technologies, and a unique business model that spans the full lifecycle of the vehicle. Distinguished by its experienced team from leading technology and automotive companies – Canoo has designed a modular electric platform purpose-built to deliver maximum vehicle interior space that is customizable across all owners in the vehicle lifecycle to support a wide range of vehicle applications for consumers and businesses, Canoo has offices in California, Michigan, and Texas. 
For more information, please visit www.canoo.com. For Canoo press materials, including photos, please visit press.canoo.com. For investors, please visit investors.canoo.com. 
Forward-Looking Statements
The information in this press release includes ""forward-looking statements"" within the meaning of the ""safe harbor"" provisions of the United States Private Securities Litigation Reform Act of 1995. Forward-looking statements may be identified by the use of words such as ""estimate,"" ""plan,"" ""project,"" ""forecast,"" ""intend,"" ""will,"" ""expect,"" ""anticipate,"" ""believe,"" ""seek,"" ""target"" or other similar expressions that predict or indicate future events or trends or that are not statements of historical matters. These forward-looking statements include, but are not limited to, statements regarding estimates and forecasts of financial and performance metrics, projections of market opportunity and market share, expectations and timing related to commercial product launches and achievement of other operational milestones, including the ability to meet and/or accelerate anticipated production timelines, Canoo's ability to capitalize on commercial opportunities, anticipated customer orders, and expectations regarding development of facilities and the negotiation, availability or receipt of state incentives. These statements are based on various assumptions, whether or not identified in this press release, and on the current expectations of Canoo's management and are not predictions of actual performance. These forward-looking statements are provided for illustrative purposes only and are not intended to serve as, and must not be relied on by any investor as, a guarantee, an assurance, a prediction or a definitive statement of fact or probability. Actual events and circumstances are difficult or impossible to predict and will differ from assumptions. Many actual events and circumstances are beyond the control of Canoo. These forward-looking statements are subject to a number of risks and uncertainties, including changes in domestic and foreign business, market, financial, political and legal conditions; failure to realize the anticipated benefits of the business combination with Hennessy Capital Acquisition Corp. IV; the rollout of Canoo's business and the timing of expected business milestones and commercial launch; future market adoption of Canoo's offerings; risks related to Canoo's go-to-market strategy and manufacturing strategy; the effects of competition on Canoo's future business; the ability to issue equity or equity-linked securities, and those factors discussed  under the captions ""Risk Factors"" and ""Management's Discussion and Analysis of Financial Condition and Results of Operations"" in Canoo's Annual Report on Form 10-K for the fiscal year ended December 31, 2020 filed with the U.S. Securities and Exchange Commission (the ""SEC"") on March 31, 2021, as well as its Quarterly Reports on Form 10-Q and other filings with the SEC, copies of which may be obtained by visiting Canoo's Investors Relations website at investors.canoo.com or the SEC's website at www.sec.gov. If any of these risks materialize or our assumptions prove incorrect, actual results could differ materially from the results implied by these forward-looking statements. There may be additional risks that Canoo does not presently know or that Canoo currently believes are immaterial that could also cause actual results to differ from those contained in the forward-looking statements. In addition, forward-looking statements reflect Canoo's expectations, plans or forecasts of future events and views as of the date of this press release. Canoo anticipates that subsequent events and developments will cause Canoo's assessments to change. However, while Canoo may elect to update these forward-looking statements at some point in the future, Canoo specifically disclaims any obligation to do so. These forward-looking statements should not be relied upon as representing Canoo's assessments as of any date subsequent to the date of this press release. Accordingly, undue reliance should not be placed upon the forward-looking statements. 
 View original content to download multimedia:https://www.prnewswire.com/news-releases/canoo-increases-production-guidance-and-targets-for-us-facilities-301445873.html
SOURCE  Canoo
Released December 15, 2021"
