URL,StructuredResponse
https://blog.hubspot.com/marketing/competitive-analysis-kit,"Trusted by business builders worldwide, the HubSpot Blogs are your number-one source for education and inspiration.
Resources and ideas to put modern marketers ahead of the curve
Strategies to help you elevate your sales efforts
Everything you need to deliver top-notch customer service
Tutorials and how-tos to help you build better websites
The insights you need to make smarter business decisions
Your essential daily read on all things AI and business.
All of HubSpot's handcrafted email newsletters, tucked in one place.
Irreverent and insightful takes on business and tech, delivered to your inbox
Browse our collection of educational shows and videos on YouTube.
Our unrivaled storytelling, in video format. Subscribe for little revelations across business and tech
Learn marketing strategies and skills straight from the HubSpot experts
When it comes to brainstorming business ideas, Sam and Shaan are legends of the game
Watch two cerebral CMOs tackle strategy, tactics, and trends
Everything you need to know about building your business on HubSpot
HubSpot Podcast Network is the destination for business professionals who seek the best education on how to grow a business.
Each week, hosts Sam Parr and Shaan Puri explore new business ideas based on trends and opportunities in the market
Redefining what success means and how you can find more joy, ease, and peace in the pursuit of your goals
A daily dose of irreverent, offbeat, and informative takes on business and tech news
Each week, Another Bite breaks down the latest and greatest pitches from Shark Tank
Build your business for far and fast success 
HubSpot CMO Kipp Bodnar and Zapier CMO Kieran Flanagan share what's happening now in marketing and what's ahead
Expand your knowledge and take control of your career with our in-depth guides, lessons, and tools.
Learn and get certified in the latest business trends from leading experts
Interactive documents and spreadsheets to customize for your business's needs
In-depth guides on dozens of topics pertaining to the marketing, sales, and customer service industries
Multi-use content bundled into one download to inform and empower you and your team
Customized assets for better branding, strategy, and insights
All of HubSpot's marketing, sales, customer service, CMS, operations, and commerce software on one platform. See pricing
Marketing automation software. Free and premium plans
Sales CRM software. Free and premium plans
Customer service software. Free and premium plans
Content management software. Free and premium plans
Operations software. Free and premium plans
B2B commerce software. Free and premium plans
Try another search, and we'll give it our best shot.
Published: 
  
    
  
  
  
    November 10, 2022 
  

 
Track and analyze your competitors with these ten free planning templates.
When was the last time you ran a competitive analysis for your brand? And most importantly, do you know how to do one efficiently?
If you‘re unsure or if the last ""analysis"" you ran was a quick perusal of a competitor’s website, you're likely missing out on important intelligence that could help your brand grow.

In this detailed guide, you'll learn how to conduct a competitive analysis to give your business an advantage.
Table of Contents

A competitive analysis is a strategy that involves researching major competitors to gain insight into their products, sales, and marketing tactics. Implementing stronger business strategies, warding off competitors, and capturing market share are just a few benefits of conducting a competitive market analysis.

A competitive analysis can help you learn the ins and outs of how your competition works and identify potential opportunities where you can outperform them. It also enables you to stay atop of industry trends and ensure your product is consistently meeting — and exceeding — industry standards.
Let's dive into a few more benefits of conducting competitive analyses:
Competitive analysis is a meticulous strategy that dives deep into the operations of your prime competitors.
It's not just about knowing what they offer. You need to understand their sales strategies, marketing tactics, and the ethos driving their brand.
Track and analyze your competitors with these ten free planning templates.
Click this link to access this resource at any time.
The ripple effects of a well-executed competitive analysis are manifold:
While it's essential to understand how your competition operates, the real magic happens when you can:
Competitive market research is a vital exercise that goes beyond merely comparing products or services.
It involves an in-depth analysis of the market metrics that distinguish your offerings from those of your competitors.
A thorough market research doesn't just highlight these differences but leverages them, laying a solid foundation for a sales and marketing strategy that truly differentiates your business in a bustling market.
In the next section, we’ll explore the nuts and bolts of conducting a detailed competitive analysis tailored to your brand.
Every brand can benefit from regular competitor analysis. By performing a competitor analysis, you'll be able to:
As you can see, learning any of these four components will lead your brand down the path of achievement.
Next, let's dive into some steps you can take to conduct a comprehensive competitive analysis.



To run a complete and effective competitive analysis, use these ten templates, which range in purpose from sales to marketing to product strategy.

Download Now
First, you‘ll need to figure out who you’re competing with to compare the data accurately. What works in a business like yours may not work for your brand.
So how can you do this?
Divide your “competitors” into two categories: direct and indirect.
Direct competitors are businesses that offer a product or service that could pass as a similar substitute for yours and that operate in your same geographic area.
On the flip side, an indirect competitor provides products that are not the same but could satisfy the same customer need or solve the same problem.
It seems simple enough on paper, but these two terms are often misused.
When comparing your brand, you should only focus on your direct competitors. This is something many brands get wrong.
Let's use an example: Stitch Fix and Fabletics are both subscription-based services that sell clothes on a monthly basis and serve a similar target audience.
But as we look deeper, we can see that the actual product (clothes in this case) is not the same; one brand focuses on stylish everyday outfits while the other is workout-centric attire only.
Yes, these brands satisfy the same need for women (having trendy clothes delivered right to their doorstep each month), but they do so with completely different types of clothing, making them indirect competitors.
This means Kate Hudson‘s team at Fabletics would not want to spend their time studying Stitch Fix too closely since their audiences probably vary quite a bit. Even if it’s only slightly, this tiny variation is enough to make a big difference.
Now, this doesn't mean you should toss your indirect competitors out the window completely.
Keep these brands on your radar since they could shift positions at any time and cross over into the direct competitor zone. Using our example, Stitch Fix could start a workout line, which would certainly change things for Fabletics.
This is also one of the reasons why you‘ll want to routinely run a competitor analysis. The market can and will shift at any time, and if you’re not constantly scoping it out, you won‘t be aware of these changes until it’s too late.
Track and analyze your competitors with these ten free planning templates.
Click this link to access this resource at any time.
At the heart of any business is its product or service, which is what makes this a good place to start.
You‘ll want to analyze your competitor’s complete product line and the quality of the products or services they're offering.
You should also take note of their pricing and any discounts they're offering customers.
Some questions to consider include:
Running a sales analysis of your competitors can be a bit tricky.
You'll want to track down the answers to questions such as:
These helpful pieces of information will give you an idea of how competitive the sales process is and what information you need to prepare your sales reps with to compete during the final buy stage.
For publicly held companies, you can find annual reports online, but you'll have to do some sleuthing to find this info from privately owned businesses.
You could find some of this information by searching through your CRM and reaching out to those customers who mentioned they were considering your competitor.
Find out what made them choose your product or service over others out there.
To do this, run a report that shows all prospective deals where there was an identified competitor.
If this data is not something you currently record, talk to marketing and sales to implement a system where prospects are questioned about the other companies they are considering.
Essentially, they‘ll need to ask their leads (either through a form field or during a one-on-one sales conversation) to identify who their current service providers are, who they’ve used in the past, and who else they are considering during the buying process.
When a competitor is identified, have your sales team dive deeper by asking why they are considering switching to your product. If you've already lost the deal, be sure to follow up with the prospect to determine why you lost to your competitor.
What services or features attracted the prospect? Was it about price? What‘s the prospect’s impression of your sales process? If they've already made the switch, find out why they made this decision.
By asking open-ended questions, you'll have honest feedback about what customers find appealing about your brand and what might be turning customers away.
Once you‘ve answered these questions, you can start scoping out your competitor’s marketing efforts.
There are a few major factors that go into correctly pricing your product — and one major one is understanding how much your competitors are charging for a similar product or service.
If you feel your product offers superior features compared to those of a competitor, you might consider making your product or service more expensive than industry standards.
However, if you do that, you'll want to ensure your sales reps are ready to explain why your product is worth the additional cost.
Alternatively, perhaps you feel there‘s a gap in your industry for affordable products. If that’s the case, you might aim to charge less than competitors and appeal to prospects who aren't looking to break the bank for a high-quality product.
Of course, other factors go into correctly pricing a product, but it‘s critical you stay on top of industry pricing to ensure you’re pricing your product in a way that feels reasonable to prospects.
Additionally, take a look at any perks your competitors offer and how you might match those perks to compete. For instance, perhaps your competitors offer a major referral discount or a month-long free trial version.
These perks could be the reason you‘re losing customers, so if it feels reasonable for your brand, consider where you might match those perks — or provide some unique perks of your own if competitors don’t offer any.
Did you know expensive shipping is the number one reason for cart abandonment?
Nowadays, free shipping is a major perk that can attract consumers to choose one brand over another. If you work in an industry where shipping is a major factor — like e-commerce — you‘ll want to take a look at competitors’ shipping costs and ensure you're meeting (if not exceeding) those prices.
If most of your competitors offer free shipping, you‘ll want to look into the option for your own company. If free shipping isn’t a practical option for your business, consider how you might differentiate in other ways — including loyalty programs, holiday discounts, or giveaways on social media.
Track and analyze your competitors with these ten free planning templates.
Click this link to access this resource at any time.
Analyzing your competitor's website is the fastest way to gauge their marketing efforts. Take note of any of the following items and copy down the specific URL for future reference:
Then, take a look at the quantity of these items. Do they have several hundred blog posts or a small handful? Are there five white papers and just one e-book?
Next, determine the frequency of these content assets. Are they publishing something new each week or once a month? How often does a new e-book or case study come out?
Chances are, if you come across a robust archive of content, your competitor has been publishing regularly. Depending on the topics they're discussing, this content may help you hone in on their lead-generating strategies.
From there, you should move on to evaluating the quality of their content. After all, if the quality is lacking, it won‘t matter how often they post since their target audience won’t find much value in it.
Choose a small handful of samples to review instead of tackling every single piece to make the process more manageable.
Your sampler should include content pieces covering a variety of topics, so you'll have a fairly complete picture of what your competitor shares with their target audience.
When analyzing your competitor's content, consider the following questions:
As you continue to scan the content, pay attention to the photos and imagery your competitors are using.
Do you quickly scroll past generic stock photos, or are you impressed by custom illustrations and images? If they're using stock photos, do they at least have overlays of text quotes or calls-to-action that are specific to their business?
If their photos are custom, are they sourced from outside graphic professionals, or do they appear to be done in-house?
When you have a solid understanding of your competitor‘s content marketing strategy, it’s time to find out if it's truly working for them.
Understanding what types of technology your competitors use can be critical for helping your own company reduce friction and increase momentum within your organization.
For instance, perhaps you‘ve seen positive reviews about a competitor’s customer service — as you're conducting research, you learn the customer uses powerful customer service software you haven't been taking advantage of.
This information should arm you with the opportunity to outperform your competitors' processes.
To figure out which software your competitors use, type the company's URL into Built With, an effective tool for unveiling what technology your competitors' site runs on, along with third-party plugins ranging from analytics systems to CRMs.
Alternatively, you might consider looking at competitors' job listings, particularly for engineer or web developer roles. The job listing will likely mention which tools a candidate needs to be familiar with — a creative way to gain intel into the technology your competitors use.
To gauge how engaging your competitor‘s content is to their readers, you’ll need to see how their target audience responds to what they're posting.
Check the average number of comments, shares, and likes on your competitor's content and find out if:
From engagement, you‘ll move right along to your competitor’s content promotion strategy.
The following questions can also help you prioritize and focus on what to pay attention to:
The last area you‘ll want to evaluate when it comes to marketing is your competitor’s social media presence and engagement rates.
How does your competition drive engagement with their brand through social media? Do you see social sharing buttons with each article? Does your competitor have links to their social media channels in the header, footer, or somewhere else? Are these clearly visible? Do they use calls-to-action with these buttons?
If your competitors are using a social network that you may not be on, it's worth learning more about how that platform may be able to help your business, too.
To determine if a new social media platform is worth your time, check your competitor's engagement rates on those sites. First, visit the following sites to see if your competition has an account on these platforms:
Then, take note of the following quantitative items from each platform:
With the same critical eye you used to gauge your competition's content marketing strategy, take a fine-toothed comb to analyze their social media strategy.
What kind of content are they posting? Are they more focused on driving people to landing pages, resulting in new leads? Or are they posting visual content to promote engagement and brand awareness?
How much of this content is original? Do they share curated content from other sources? Are these sources regular contributors? What is the overall tone of the content?
How does your competition interact with its followers? How frequently do their followers interact with their content?
After you collect this data, generate an overall grade for the quality of your competitor's content. This will help you compare the rest of your competitors using a similar grading scale.
As you evaluate each component in your competitor analysis (business, sales, and marketing), get into the habit of performing a simplified SWOT analysis at the same time.
This means you‘ll take note of your competitor’s strengths, weaknesses, opportunities, and threats any time you assess an overall grade.
Some questions to get you started include:
You‘ll be able to compare their weaknesses against your strengths and vice versa. By doing this, you can better position your company, and you’ll start to uncover areas for improvement within your own brand.
Track and analyze your competitors with these ten free planning templates.
Click this link to access this resource at any time.
Product analysis drills down to discover key differences and similarities in products that share the same general market.
If you have a competitor selling products in a similar market niche to your own — you want to ensure that you aren’t losing market share to the competition.
Leveraging the example above, we can drill down and discover some of the key differentiators in product offerings.

The first step in any product analysis is to assess current pricing.
Nintendo offers three models of its Switch console: The smaller lite version is priced at $199, the standard version is $299, and the new OLED version is $349.
Sony, meanwhile, offers two versions of its PlayStation 5 console: The standard edition costs $499, and the digital version, which doesn’t include a disc drive, is $399.
Next is a comparison of key features. In the case of our console example, this means comparing features like processing power, memory, and hard drive space.
Feature
PS5 Standard
Nintendo Switch
Hard drive space
825 GB
32 GB
RAM
16 GB
4 GB
USB ports
4 ports
1 USB 3.0, 2 USB 2.0
Ethernet connection
Gigabit
None
With basic features compared, it’s time to dive deeper with differentiators. While a glance at the chart above seems to indicate that the PS5 is outperforming its competition, this data only tells part of the story.
Here’s why: The big selling point of the standard and OLED Switch models is that they can be played as either handheld consoles or docked with a base station connected to a TV. What’s more, this “switching” happens seamlessly, allowing players to play whenever, wherever.
The Playstation offering, meanwhile, has leaned into market-exclusive games that are only available on its system to help differentiate them from their competitors.
Step 4: Identify market gaps
The last step in a competitive product analysis is looking for gaps in the market that could help your company get ahead.
When it comes to the console market, one potential opportunity gaining traction is the delivery of games via cloud-based services rather than physical hardware.
Companies like Nvidia and Google have already made inroads in this space, and if they can overcome issues with bandwidth and latency, it could change the market at scale.
How do you stack up against the competition? Where are you similar, and what sets you apart? This is the goal of competitive analysis.
By understanding where your brand and competitors overlap and diverge, you’re better positioned to make strategic decisions that can help grow your brand.
Of course, it’s one thing to understand the benefits of competitive analysis, and it’s another to actually carry out an analysis that yields actionable results. Don’t worry — we’ve got you covered with a quick example.
Let’s take a look at popular gaming system companies Sony and Nintendo.
Sony’s newest offering — the Playstation 5 — recently hit the market but has been plagued by supply shortages.
Nintendo’s Switch console, meanwhile, has been around for several years but remains a consistent seller, especially among teens and children.
This scenario is familiar for many companies on both sides of the coin; some have introduced new products designed to compete with established market leaders, while others are looking to ensure that reliable sales don’t fall.
Using some of the steps listed above, here’s a quick competitive analysis example.
In our example, it’s Sony vs Nintendo, but it’s also worth considering Microsoft’s Xbox, which occupies the same general market vertical.
This is critical for effective analysis; even if you’re focused on specific competitors and how they compare, it’s worth considering other similar market offerings.
PlayStation offers two PS5 versions, digital and standard, at different price points, while Nintendo offers three versions of its console.
Both companies also sell peripherals — for example, Sony sells virtual reality (VR) add-ons, while Nintendo sells gaming peripherals such as steering wheels, tennis rackets, and differing controller configurations.
When it comes to sales tactics and marketing, Sony and Nintendo have very different approaches.
In part thanks to the recent semiconductor shortage, Sony has driven up demand via scarcity — very low volumes of PS5 consoles remain available. Nintendo, meanwhile, has adopted a broader approach by targeting families as its primary customer base.
This effort is bolstered by the Switch Lite product line, which is smaller and less expensive, making it a popular choice for children.
The numbers tell the tale: Through September 2021, Nintendo sold 14.3 million consoles, while Sony sold 7.8 million.
Sony has the higher price point: Their standard PS5 sells for $499, while Nintendo’s most expensive offering comes in at $349. Both offer robust digital marketplaces and the ability to easily download new games or services.
Here, the key differentiators are flexibility and fidelity. The Switch is flexible — users can dock it with their television and play it like a standard console or pick it up and take it anywhere as a handheld gaming system.
The PS5, meanwhile, has superior graphics hardware and processing power for gamers who want the highest-fidelity experience.
If you compare the marketing efforts of Nintendo and Sony, the difference is immediately apparent: Sony’s ads feature realistic in-game footage and speak to the exclusive nature of their game titles.
The company has managed to secure deals with several high-profile game developers for exclusive access to new and existing IPs.
Nintendo, meanwhile, uses brightly lit ads showing happy families playing together or children using their smaller Switches while traveling.
Engagement helps drive sales and encourage repeat purchases.
While there are several ways to measure engagement, social media is one of the most straightforward: In general, more followers equates to more engagement and greater market impact.
When it comes to our example, Sony enjoys a significant lead over Nintendo: While the official Playstation Facebook page has 38 million followers, Nintendo has just 5 million.
Competitive analysis is complex, especially when you’re assessing multiple companies and products simultaneously.
To help streamline the process, we’ve created 10 free templates that make it possible to see how you stack up against the competition — and what you can do to increase market share.
Let’s break down our SWOT analysis template. Here’s what it looks like:

Download Free Templates
Strengths. Identify your strengths. These may include specific pieces of intellectual property, products that are unique to the market, or a workforce that outperforms the competition.
Weaknesses. Here, it’s worth considering potential issues around pricing, leadership, staff turnover, and new competitors in the market.
Opportunities. This part of the SWOT analysis can focus on new market niches, evolving consumer preferences, or new technologies being developed by your company.
Threats. These might include new taxes or regulations on existing products or an increasing number of similar products in the same market space that could negatively affect your overall share.
A competitive analysis framework is a structured approach used to evaluate potential competitors and understand their strengths, weaknesses, opportunities, and threats.
This framework serves as a guide for businesses to identify competitive advantages, understand market positioning, and inform strategic decisions.
Depending on the industry and the company's objectives, this framework might focus on areas like product features, market share, pricing, customer feedback, and more.
Conducting a thorough competitive analysis involves several steps:
The five key components of a competitive analysis include:
The 3 C's refer to a strategic model that considers three main factors when understanding the broader business environment:
Yes, SWOT analysis is a type of competitive analysis. SWOT stands for Strengths, Weaknesses, Opportunities, and Threats. It is a strategic planning tool used to identify and analyze these four elements of a business.
While a SWOT analysis can be focused internally on a company‘s own attributes, when used as a competitive analysis tool, it assesses a competitor’s SWOT to understand where your business has advantages or might be vulnerable.
Before you accurately compare your competition, you need to establish a baseline. This also helps when it comes time to perform a SWOT analysis.
Take an objective look at your business, sales, and marketing reports through the same metrics you use to evaluate your competition. Record this information just like you would with a competitor and use this as your baseline to compare across the board.
Editor's Note: This post was originally published prior to July 2018 but has been updated for comprehensiveness.


                      
  
    
  
  
  
    Oct 05, 2023
  


                    

                      
  
    
  
  
  
    Sep 15, 2023
  


                    

                      
  
    
  
  
  
    Aug 21, 2023
  


                    

                      
  
    
  
  
  
    Jun 01, 2023
  


                    

                      
  
    
  
  
  
    May 18, 2023
  


                    

                      
  
    
  
  
  
    May 08, 2023
  


                    

                      
  
    
  
  
  
    Mar 29, 2023
  


                    

                      
  
    
  
  
  
    Feb 22, 2023
  


                    

                      
  
    
  
  
  
    Jan 18, 2023
  


                    

                      
  
    
  
  
  
    Dec 07, 2022
  


                    
Get expert marketing tips straight to your inbox, and become a better marketer. Subscribe to the Marketing Blog below.
We're committed to your privacy. HubSpot uses the information you provide to us to contact you about our relevant content, products, and services. You may unsubscribe from these communications at any time. For more information, check out our Privacy Policy.
Want to learn how to build a blog like this?We started with one post.Download free ebook
Not using HubSpot yet?
10 free templates to help you understand and beat the competition. 
Marketing software that helps you drive revenue, save time and resources, and measure and optimize your investments — all on one easy-to-use platform
Copyright © 2024 HubSpot, Inc."
