URL,StructuredResponse
https://www.mckinsey.com/industries/consumer-packaged-goods/our-insights/the-world-of-ands-consumers-set-the-tone,"Leading consumer-facing businesses place a lot of emphasis on listening to consumers, as they should. Consumer sentiment and behavior can be fast changing, confusing, and sometimes contradictory. Today’s consumers, for instance, are both trading down and selectively splurging. They’re buying big, established brands and exploring newer, smaller ones. Many of their buying decisions are a matter of “and,” not “or.”
Staying attuned to these trends in consumer behavior can be difficult for companies, but doing so is absolutely critical—even (or perhaps especially) when the ands seem paradoxical. Quick decision making on how to meet consumers’ expectations in this world of ands must be at the top of a company’s agenda.
In addition, businesses must prioritize a series of ands themselves to grow profitably and outperform competitors. This article outlines the ands that we see playing out in consumer behavior, along with the ands that business leaders need to act on.
Many of the insights I’ll be sharing with you are powered by ConsumerWise, McKinsey’s proprietary solution that tracks and analyzes both consumer sentiment (what consumers say and how they feel) and consumer spending (what they actually do)—thus providing a 360-degree view of today’s consumers. ConsumerWise currently spans ten markets; by the end of 2023 it will expand to 20 markets, covering 90 percent of global GDP. Our latest ConsumerWise research reveals that consumers are engaging in the following four ands. It also reveals that trade-offs are false choices.
Consumers are both flocking to value and buying premium products and services. Worldwide, approximately two in three consumers are trading down by buying cheaper brands or private-label products. In Europe, 84 percent of consumers perceive branded products as having similar quality to private labels. In China, consumers are becoming more value conscious and aggressively seeking discounts and promotions.
At the same time, 44 percent of consumers around the world (and 60 percent of Gen Zers and millennials) say that they plan to splurge, particularly on purchases that are experiential or provide immediate gratification—think restaurants or travel. Regionally, intent to splurge closely aligns with economic optimism: 77 percent of Indian consumers plan to splurge, compared with only 26 percent of Japanese consumers. In short, consumer spending is falling globally, and midpriced goods and services are most at risk. Shoppers who splurge in some categories may seek value in others, which means companies must develop a detailed and nuanced understanding of trends and segments.
The majority of consumers now use at least three channels for each purchase journey. And while 75 percent of consumers want a seamless omnichannel experience, only 25 percent are satisfied with the experience that retailers provide. Omnichannel excellence is especially important given that omnichannel consumers are at least 1.25 times more valuable than their single-channel counterparts.
Consumers are also increasingly adopting new shopping channels. More than 60 percent of US and Asian consumers plan to continue using channels that they first tried during the COVID-19 pandemic, such as grocery delivery or social commerce.
Traditionally, big brands have dominated the consumer landscape, especially during times of uncertainty. In the US market, big brands grew 50 percent at the height of the pandemic. But consumers are also trying new brands: one in three consumers did so in the past three months. Gen Zers and millennials are especially susceptible to brand switching, as they are five times more likely than older generations to believe that newer brands are better or more innovative than established brands.
In general, consumers are now purchasing a repertoire of products to fill specific needs, instead of purchasing just one product. To illustrate: whereas ten years ago a typical household would have had just one type of milk in the fridge, a household today might buy cow’s milk, high-protein milk, and a plant-based alternative such as almond milk or oat milk—each for a unique occasion.
Consumers are gravitating toward sustainable products: 84 percent say that sustainability is a very important factor in their purchase decisions. However, 50 percent say they’re not sure whether they would pay a premium for sustainable products in times of inflation.
Still, products making sustainability-related claims are growing faster than products that make no such claims. Companies face the challenge of striking a balance between sustainability and price, which is especially critical in an inflationary environment.
In addition to keeping their finger on the pulse of the ever-more-demanding consumer, businesses should respond to these trends with their own ands. Companies need to be uncompromising in the following three areas.
Approximately 60 percent of top-performing CEOs are concerned about an economic downturn. Even amid the highest global inflation since the 1970s, rising interest rates, geopolitical tensions, supply chain disruptions, and volatile commodity prices, investors continue to expect profitable growth above the historical average. Against this backdrop of uncertainty, CEOs have a unique opportunity to make distinctive decisions that lift their companies above competitors. Fortune favors the bold, and pursuing growth must be a conscious, strategic choice.
Companies are more likely to outperform peers when they pursue multiple pathways to growth, including expanding into new categories and new geographies. Changing global demographics, in particular, are unlocking new growth opportunities. Consider that Africa will account for more than half of global population growth in the coming decades, and that GDP for both China and India continues to climb in global rankings. Companies that successfully expand into new geographies are 22 percent more likely to achieve above-market, accretive growth.
Companies that wish to keep up must speed up—and scale up. The pandemic created a greater chasm between retail leaders and laggards: more than 90 percent of growth in retail market cap was driven by 25 large, tech-forward retailers. We expect further market consolidation, accelerated by the end of cheap capital.
But scale must not come at the expense of personalization. The bigger your company, the better you should get at localizing and personalizing your offerings. More than 70 percent of consumers expect personalization and are frustrated when companies don’t deliver it. Companies that excel at personalization generate 40 percent more revenue from those activities than average players.
Historically, more than 80 percent of consumer companies’ growth has come from core offerings. Clearly, nurturing the core isn’t optional—and we’ve found, in fact, that many companies underestimate the core’s growth potential.
But as consumer behaviors diverge, companies must seek to become indispensable in consumers’ lives by expanding beyond products and into a range of services. Companies would do well to start pursuing “share of life,” not just share of wallet. Traditional sector barriers are falling; McKinsey research suggests that one-third of global GDP will soon come from ecosystems (which are networks or partnerships that cut across different industries). And consumers are receptive: for example, 60 percent of European consumers say they’re willing to buy services from retailers they trust. Companies can also tap into B2B opportunities—an excellent example being the rise of retail media networks, which generate a significant amount of incremental revenue and operating margins as well as generating valuable new consumer insights.
Consumers today live in a world of ands—they’re much more demanding and less willing to make trade-offs. Businesses, too, should live in a world of ands. If they take an uncompromising stance on the three aforementioned imperatives, the payoff will be above-average growth and healthy margins.
The author wishes to thank Christina Adams, Kari Alldredge, Ali Bergmann, Dallas Cullen, Warren Teichner, Björn Timelin, and Anja Weissgerber for their contributions to this article.
This article was edited by Monica Toriello, an editorial director in the New York office."
,
https://www.mckinsey.com/capabilities/growth-marketing-and-sales/our-insights/the-great-consumer-shift-ten-charts-that-show-how-us-shopping-behavior-is-changing,"Anyone who has hosted a game night over video chat or ordered groceries to be delivered at home for the first time understands how profoundly the COVID-19 crisis has changed our behavior as consumers. But which of these changes will stick? We see several that are key:
We’ve boiled down extensive McKinsey consumer research into ten exhibits to illustrate the trends and the consumer segments associated with each.
Physical distancing and stay-at-home orders have forced whole consumer segments to shop differently. A few months into COVID-19, consumer shopping online has increased significantly across many categories. Consumer intent to shop online continues to increase, especially in essentials and home-entertainment categories. More interestingly, these habits seem like they’re going to stick as US consumers report an intent to shop online even after the COVID-19 crisis. Categories where expected growth in online shoppers exceeds 35 percent include essentials such as over-the-counter (OTC) medicine, groceries, household supplies, and personal-care products. Even discretionary categories such as skin care and makeup, apparel, and jewelry and accessories show expected customer growth of more than 15 percent.
While the shift to online shopping has been near universal across categories, high-income earners and millennials are leading the way in shifting spend online across both essential and nonessential items. Gen X has experienced a similar online shift, although not at the same scale as millennials. Gen Z has concentrated its shift online in particular categories: apparel and footwear, at-home entertainment, and food takeout/delivery.
The crisis has prompted a surge of new activities, with an astonishing 75 percent of US consumers trying a new shopping behavior in response to economic pressures, store closings, and changing priorities. This general change in behavior has also been reflected in a shattering of brand loyalties, with 36 percent of consumers trying a new product brand and 25 percent incorporating a new private-label brand. Of consumers who have tried different brands, 73 percent intend to continue to incorporate the new brands into their routine. Gen Z and high earners are most prone to switching brands.
The beneficiaries of this shift include big, trusted brands, which are seeing 50 percent growth during the crisis, and private labels, which have outpaced the retail market. Some 80 percent of customers who started using a private brand during the pandemic indicate they intend to continue using it once the COVID-19 crisis subsides.
Shoppers have cited a number of reasons for switching brands, with availability (in-store and online), convenience, and value leading the pack.
For marketers, this highlights the need to quickly become aware of when shoppers are migrating brands or retailers and then to manage the logistics to ensure product and service availability. Looking at China, which is further along in its recovery cycle than most countries, the increase in promotional activity to cater to consumers’ focus on value in apparel is expected to continue.
As Americans contemplate going back out to shop, hygiene and hygiene transparency have emerged as important sources of concern. It is becoming increasingly important for stores and restaurants to not only follow hygiene protocols (thorough cleaning and masks for consumers and employees are top priorities) but also communicate effectively that they are following those procedures.
US consumers have already started to change their behavior in response to hygiene concerns. Technologies that enhance hygiene, particularly contactless activities such as food and grocery delivery and curbside pickup, are taking off. There is strong intent to continue contactless activities across the United States. As an example, 79 percent of consumers intend to continue or increase their usage of self-checkout in retail after COVID-19. Millennials and Gen Z are the widest adopters of contactless activities.
Around 40 percent of US consumers have reduced spending in general, and they expect to continue to cut back on nonessentials specifically. This reality reflects profound discomfort about the state of the economy.
With overall consumer spending declining, intent to spend in essential categories is increasing. Even among those with higher incomes, we see that while essentials show spending momentum, intent to buy discretionary products still lags significantly. As the worst of the crisis abates, we do see online spending in nonessential categories such as apparel and footwear starting to come back. This effect is strongest among high-income earners, consumers in the Northeast, and Gen Z.
Tied to the concern about the state of the economy is an increasing consumer focus on value—especially for essential categories. For example, in shampoo on Amazon, value and mass products have experienced the greatest increase in share, at two- and five-percentage-points gains, respectively. Premium shampoo products have seen significantly less growth in comparison, losing more than five points of volume.
Americans are spending more of their at-home time on domestic activities, media, and news. Intent to eat more at home post-COVID-19 has strengthened significantly over the past three months. Usage of popular online entertainment platforms has skyrocketed. (The popular video game Fortnite recently hosted a concert that was “attended” by 12.3 million users.1Andrew Webster, “More than 12 million people attended Travis Scott’s Fortnite concert,” The Verge, April 23, 2020, theverge.com.) Investment in at-home fitness through equipment purchases and online activity is growing. Consumers still expect to spend more time on at-home activities, even in less-restricted regions.
As economies reopen, 73 percent of consumers are still hesitant to resume regular activities outside the home. They are concerned about going to a hair salon, gym, or restaurant, but are especially worried about shared environments, such as public transportation, ride sharing, air travel, and being in crowded spaces, such as attending large indoor or outdoor events.
US consumer-segment behavior varies significantly across the next-normal trends. We have identified five customer segments driven by optimism, health, and financial concerns, each of relatively similar size. These five segments exhibit the consumer trends to a different degree and have the following characteristics:
Affluent and unaffected: These consumers express general optimism about the future (~20 percent higher than the overall US consumer population), skew male (60 percent), and make more than $100,000 a year. They tend to be able to stay at home during the pandemic crisis, allowing them to shop more online. This group is slightly less price sensitive than other cohorts due to greater job stability.
Uprooted and underemployed: These consumers are feeling major impact on both their finances and health due to job insecurity. They are cautious about how they spend money, with low optimism about future economic conditions. Not surprisingly, this group is trading down to essentials and value, swapping out brands, and shopping online when possible.
Financially secure but anxious: This population is largely 65 years old and older and is generally pessimistic about economic conditions after COVID-19, which has had a major impact on their habits. This group has expressed the greatest need for hygiene transparency, with above-average concerns on safety and well-being and concerns about the ability to get necessary supplies.
Out trying to make ends meet: These consumers are being cautious about how they spend money and feel that their jobs and job security have been heavily impacted by COVID-19. This group has significant representation from minority groups and rural populations. They are less likely to be able to stay at home (hence their lower likelihood to be part of the homebody economy), but they are strongly moving toward shopping for essentials and value.
Disconnected and retired: This category denotes those who are retired, over 65, and have a lower income level than the financially-secure-but-anxious segment. They are broadly optimistic about economic conditions after COVID-19 and are less likely to display any of the next-normal characteristics. Predominantly from Southern and suburban areas of the country, this group has not exhibited significant changes in shopping behavior.
As retailers contemplate the changes in consumer behavior, they will need to adjust their strategies and execution to adapt to the new norms, including:
Further, it will be important for brands to reevaluate and reprioritize their target audience and consumer segments, as the emphasis on each of the next-normal trends will vary based on the target consumer.
Tamara Charm is a senior expert in McKinsey’s Boston office, where Jamie Wilkie is a partner; Becca Coggins is a senior partner in the Chicago office; and Kelsey Robinson is a partner in the San Francisco office.
The authors wish to thank Nidhi Aurora, Sarah Coury, Resil Das, and Salvador Tormo for their contributions to this article."
